{
  "candidate_archive_sha256": "aaaaaaaaaaaaaaaaaaaaaaaaaaaaaaaaaaaaaaaaaaaaaaaaaaaaaaaaaaaaaaaa",
  "format_version": "1.0",
  "host_id": "host-v10-1-test-0001",
  "identity_kind": "AZPR_V10_1_EXTERNAL_RECEIPT_SIGNER_IDENTITY",
  "not_after": "2026-08-14T00:32:30.917898+00:00",
  "not_before": "2026-08-06T00:32:30.917898+00:00",
  "receipt_signing_public_key_sha256": "f49208f3d47fd091f232cb401326ef367642f7fcdf0cd78064a7f22b37e8091d",
  "signer_client_sha256": "24b35f64dd56230c2cb614d3730cefbd1006fd0ce5e3e78fed58851dba9164b3",
  "signer_id": "receipt-signer-v10-1-0001"
}
